{
  "schema": "wea.reuse-certificate/v1",
  "schema_version": "1.0.0",
  "kind": "ReuseCertificate",
  "certificate_id": "sha256:1111111111111111111111111111111111111111111111111111111111111111",
  "certificate_version": "1.0.0",
  "subject": {
    "artifact_digest": "sha256:eeeeeeeeeeeeeeeeeeeeeeeeeeeeeeeeeeeeeeeeeeeeeeeeeeeeeeeeeeeeeeee"
  },
  "task": {
    "task_spec_digest": "sha256:2222222222222222222222222222222222222222222222222222222222222222",
    "operation_key": "sha256:3333333333333333333333333333333333333333333333333333333333333333",
    "realization_key": "sha256:4444444444444444444444444444444444444444444444444444444444444444",
    "result_mode": "execution-equivalent"
  },
  "producer": {
    "executor_digest": "sha256:5555555555555555555555555555555555555555555555555555555555555555",
    "model_revision": null,
    "prompt_digest": "hmac-sha256:6666666666666666666666666666666666666666666666666666666666666666",
    "toolchain_digest": "sha256:7777777777777777777777777777777777777777777777777777777777777777"
  },
  "inputs": {
    "dependency_manifest_root": "sha256:8888888888888888888888888888888888888888888888888888888888888888",
    "negative_dependency_root": "sha256:9999999999999999999999999999999999999999999999999999999999999999",
    "external_inputs_root": "sha256:aaaaaaaaaaaaaaaaaaaaaaaaaaaaaaaaaaaaaaaaaaaaaaaaaaaaaaaaaaaaaaaa",
    "completeness": "complete"
  },
  "environment": {
    "environment_contract_digest": "sha256:bbbbbbbbbbbbbbbbbbbbbbbbbbbbbbbbbbbbbbbbbbbbbbbbbbbbbbbbbbbbbbbb",
    "actual_environment_digest": "sha256:cccccccccccccccccccccccccccccccccccccccccccccccccccccccccccccccc",
    "hermetic": true
  },
  "effects": {
    "read_scope": [
      "workspace://snapshot"
    ],
    "write_scope": [],
    "write_semantics": "none",
    "network_access": "deny",
    "external_side_effects": "none",
    "determinism": "deterministic",
    "replay_policy": "safe",
    "observed_read_set_root": "sha256:3333333333333333333333333333333333333333333333333333333333333333",
    "observed_write_set_root": "sha256:4444444444444444444444444444444444444444444444444444444444444444",
    "network_events_root": "sha256:5555555555555555555555555555555555555555555555555555555555555555",
    "undeclared_reads": [],
    "undeclared_writes": []
  },
  "authority": {
    "tenant": "tenant-a",
    "project": "project-a",
    "classification": "internal",
    "compartments": [],
    "capabilities_used": [
      "repo.read"
    ]
  },
  "security": {
    "taints": [],
    "allowed_consumers": [
      "project-a"
    ],
    "allowed_purposes": [
      "development"
    ],
    "capabilities_granted": [
      "repo.read"
    ]
  },
  "validators": [
    {
      "validator_digest": "sha256:dddddddddddddddddddddddddddddddddddddddddddddddddddddddddddddddd",
      "predicate": "verification-schema-valid",
      "evidence_digest": "sha256:eeeeeeeeeeeeeeeeeeeeeeeeeeeeeeeeeeeeeeeeeeeeeeeeeeeeeeeeeeeeeeee",
      "result": "pass",
      "expires_at": "2026-07-14T12:00:00Z"
    }
  ],
  "validity": {
    "issued_at": "2026-07-13T12:00:00Z",
    "expires_at": "2026-07-14T12:00:00Z",
    "policy_digest": "sha256:ffffffffffffffffffffffffffffffffffffffffffffffffffffffffffffffff",
    "invalidation_topics": [
      "repo-snapshot"
    ]
  },
  "provenance": {
    "parent_certificate_digests": [],
    "trace_id": "0123456789abcdef0123456789abcdef",
    "attempt_id": "11111111-1111-4111-8111-111111111111",
    "instance_ref": {
      "instance_id": "sha256:cccccccccccccccccccccccccccccccccccccccccccccccccccccccccccccccc",
      "template_release": {
        "logical_id": "core/minimal-flow",
        "template_version": "1.0.0",
        "release_digest": "sha256:aaaaaaaaaaaaaaaaaaaaaaaaaaaaaaaaaaaaaaaaaaaaaaaaaaaaaaaaaaaaaaaa",
        "spec_digest": "sha256:bbbbbbbbbbbbbbbbbbbbbbbbbbbbbbbbbbbbbbbbbbbbbbbbbbbbbbbbbbbbbbbb"
      },
      "instance_spec_digest": "sha256:dddddddddddddddddddddddddddddddddddddddddddddddddddddddddddddddd"
    }
  },
  "cache_decision": {
    "authorized_mode": "EXACT",
    "gate_results": [
      {
        "gate": "authority",
        "status": "PASS",
        "critical": true,
        "evidence_digest": "sha256:0000000000000000000000000000000000000000000000000000000000000000",
        "reason": null
      },
      {
        "gate": "contract",
        "status": "PASS",
        "critical": true,
        "evidence_digest": "sha256:1111111111111111111111111111111111111111111111111111111111111111",
        "reason": null
      },
      {
        "gate": "dependency",
        "status": "PASS",
        "critical": true,
        "evidence_digest": "sha256:2222222222222222222222222222222222222222222222222222222222222222",
        "reason": null
      },
      {
        "gate": "effect",
        "status": "PASS",
        "critical": true,
        "evidence_digest": "sha256:3333333333333333333333333333333333333333333333333333333333333333",
        "reason": null
      },
      {
        "gate": "environment",
        "status": "PASS",
        "critical": true,
        "evidence_digest": "sha256:4444444444444444444444444444444444444444444444444444444444444444",
        "reason": null
      },
      {
        "gate": "freshness",
        "status": "PASS",
        "critical": true,
        "evidence_digest": "sha256:5555555555555555555555555555555555555555555555555555555555555555",
        "reason": null
      },
      {
        "gate": "integrity",
        "status": "PASS",
        "critical": true,
        "evidence_digest": "sha256:6666666666666666666666666666666666666666666666666666666666666666",
        "reason": null
      },
      {
        "gate": "noninterference",
        "status": "PASS",
        "critical": true,
        "evidence_digest": "sha256:7777777777777777777777777777777777777777777777777777777777777777",
        "reason": null
      },
      {
        "gate": "risk",
        "status": "PASS",
        "critical": true,
        "evidence_digest": "sha256:8888888888888888888888888888888888888888888888888888888888888888",
        "reason": null
      },
      {
        "gate": "schema",
        "status": "PASS",
        "critical": true,
        "evidence_digest": "sha256:9999999999999999999999999999999999999999999999999999999999999999",
        "reason": null
      },
      {
        "gate": "trust",
        "status": "PASS",
        "critical": true,
        "evidence_digest": "sha256:aaaaaaaaaaaaaaaaaaaaaaaaaaaaaaaaaaaaaaaaaaaaaaaaaaaaaaaaaaaaaaaa",
        "reason": null
      },
      {
        "gate": "verifier",
        "status": "PASS",
        "critical": true,
        "evidence_digest": "sha256:bbbbbbbbbbbbbbbbbbbbbbbbbbbbbbbbbbbbbbbbbbbbbbbbbbbbbbbbbbbbbbbb",
        "reason": null
      }
    ]
  },
  "risk_budget": {
    "max_error_rate": 0.001,
    "max_age_seconds": 86400,
    "validation_wall_time_ms": 1000
  },
  "signature": {
    "key_id": "builder-key-1",
    "algorithm": "ed25519",
    "signature_digest": "sha256:0000000000000000000000000000000000000000000000000000000000000000"
  }
}
